{"edge_labels":[[{"key":[1],"slope":[1,0]}],[{"key":[1,1],"slope":[1,1]},{"key":[2,1],"slope":[1,1]}]],"free":[],"grid":[2,2],"relations":[{"slope":[57896044618658097711785492504343953926634992332820282019728792003956564819967,57896044618658097711785492504343953926634992332820282019728792003956564819966],"vertex":[1,1]},{"slope":[57896044618658097711785492504343953926634992332820282019728792003956564819966,57896044618658097711785492504343953926634992332820282019728792003956564819967],"vertex":[2,2]},{"slope":[1,2],"vertex":[1,1]},{"slope":[0,1],"vertex":[1,2]},{"slope":[0,1],"vertex":[2,1]}],"slopes":[[0,0],[1,0],[1,1],[1,2],[0,1],[57896044618658097711785492504343953926634992332820282019728792003956564819967,57896044618658097711785492504343953926634992332820282019728792003956564819966],[57896044618658097711785492504343953926634992332820282019728792003956564819966,57896044618658097711785492504343953926634992332820282019728792003956564819967]],"source":"candidate CI resource fixture exercising active signed-255-bit arithmetic"}
