{"claimed_score":"1/1","edge_labels":[[{"key":[1],"slope":[1,0]}],[{"key":[1,1],"slope":[1,1]},{"key":[2,1],"slope":[1,1]}]],"free":[],"grid":[2,2],"relations":[{"slope":[1,1],"vertex":[1,1]},{"slope":[0,1],"vertex":[1,2]},{"slope":[0,1],"vertex":[2,1]}],"slopes":[[0,0],[1,0],[1,1],[1,2],[0,1]],"source":"arithmetic_kakeya_forcing_certificate_2026_06.md section 3"}
